,model,positive,negative,comment
0,product--smartfon-xiaomi-redmi-note-13-pro-4g,"['Шустрый, приятный и яркий экран, камера шикарная', 'Заказ пришел вовремя, как и был заявлено. Коробка в идеальном состоянии, в пленке. Сам телефон отличный, меня все устраивает, по крайней мере по прошествии недели не заметил каких то неудобств. Быстро перенес данные со старого смартфона.', 'все супер. объем памяти, быстрота, отличная производительность и камера.', 'быстро работает, хорошая камера, автономность', 'шустрый, камера хорошая батарея , оперативка 12 ,память 512', 'Шустрый малыш, быстро летает. Всё идеально Камера огонь, фото и просто супер. Зарядка очень быстро заряжает. Хороший телефон', 'отличный смартфон за такую цену', 'Взял из-за дизайна, понравился больше чем версия 5g.', 'задняя крышка стекло, рамка металлическая, шустрый, экран приятный для глаза при 120 МГц, достойная камера и фронт, и мейн', 'хороший удобный быстрый', 'Все хорошо', 'классный смарт брал на подарок очень понравился работает быстро.', 'выглядит отлично, хорошая камера, скорость работы на высоте', 'Удобный, быстрый, легкий', 'Камера отменная. Все просто летает. Дисплей отменного качества. Оперативная память расширяется до 16 Гб.', 'Соответствует описанию. Покупал в подарок жене, ей очень понравилось. Шустрый процессор, яркий экран, хороший звук.', 'Всë отлично, спасибо, товар супер.', 'отличный смартфон!!!', 'Хороший и шустрый. Видео снимает четко.', 'Огонь', 'новый', 'Телефон понравился. Достаточно быстрый', 'камера и большой экран', 'шустрый, летает быренько))', 'Благодаря своим характеристикам отличное средство для различных коммуникаций. Работает на радость мне!']","['массивный блок камер в сравнении с многими аналогами, но думаю к этому быстро привыкаешь', 'Пока не заметил, возможно через какое то время дополню.', 'нет никаких недостатков сплошные плюсы', 'сложно найти ударопрочный чехол (пришлось заказывать с алиэкспресса)', 'недостатков нет', 'не выявлено, работает хорошо', 'нету', 'Пока нет нареканий.', 'нет', 'Слишком сильно выпирает камера', 'пока не нашел', 'Пока не обнаружено.', 'Не обнаружил', 'нет', 'Не найдено', 'Нет', 'нет', 'Пока не определены', 'пока все работает', 'уведомления иногда в ватс апе не приходят, т.е. заходишь в сам ватс ап, а там тебе написали, уведомление не пришло. А так перезагрузила тлф , работает норм ватс ап', 'пока не обнаружены']","['Телефоном очень довольна. Уже много лет пользуюсь Сяоми Редми, но это самая впечатляющая покупка. Как рядовой пользователь я очень довольна.Очень шустрый, быстро перенесла данные со старого телефона, все настроила под себя. Хочу отметить классный стерео звук, прикольный сканер отпечатка пальца на самом экране, качество картинки и фотографии. Телефон приятно держать в руках. Заказывала доставку из зарубежа, чтоб была глобальная прошивка. От момента заказа до доставки прошло 9 дней. Спасибо продавцу и Яндекс маркету.', 'шикарный мощный смартфон за небольшую плату. ничуть не уступает по всем качествам другим дорогущим телефонам. Айфон в подметки не годится.', 'прекрасный телефон, недавно прилетело обновление на hyperOS', 'сделала себе подарок и не пожалела телефон супер!', 'Советую к покупке, не пожалеете!', 'Доставка пришла раньше срока, все соответствует характеристикам', 'отличный смартфон в этой ценовой категории, определенно стоит покупать, если сомневаетесь.', 'отличный аппарат.', 'советую,', 'Рекомендую к покупке', 'Всë отлично, доставленно в срок, супер.', 'Стоит своих денег. Рекомендую.', 'Все супер, за такую цену.', 'Все отлично мне нравится,просто бомба', 'всё отлично!']"
1,product--smartfon-xiaomi-redmi-note-13-4g,"['Классный дизайн, хорошие характеристики, доступная цена', 'отличный телефон в пользовании больше недели, гораздо дешевле чем в магазине, например у нас в Поволжье, приятный бонус чехол и плёнка от царапин в комплекте, перешёл с самсунга.', 'Все отлично работает', 'Смартфоном пользуюсь около двух недель. Очень нравится. Удобен для повседневной жизни.', 'есть', 'Цена,качество', '120 гц, 8/128 гб, чехол, зарядка, шнур в комплекте, пленка уже нанесена', 'Отлично работает', 'работает, батарея 2 дня', 'яркий, шустрый, хороший объем памяти, симпатичный внешне', 'Экран !!! И все остальное', 'пойдëть, работает!', 'четкий телефон 👍👍👍', 'очень порадовал отличнейший бампер в комплекте с телефоном.', 'чёткие фото.', 'Хороший.', 'Цена,качество', 'отличное качество работы', 'не плох', 'камера просто класс', 'очень нравится', 'работает', 'идеальный подарок', 'чёткая камера, приятный в руках, всё работает, комплектация полная, девушка довольна, хотела эту модель,', 'Классный дизайн, хорошая эргономика, неплохая камера, яркий и плавный экран, большая батарея']","['трудно найти защитное стекло как смартфон новый марки', 'нет', 'нет', 'пока не обнаружила', 'пока все устраивает', 'нет', 'нет', 'нет', 'не нашлось', 'нет', 'Нет', 'Потеет камера', 'нет', 'пока нет', 'нет', 'сначала не заметил, однако потом увидели, что покацаный объектив камеры, фото придожил', 'Процессор такой же, как и в Note 12, т.е. производительность не изменилась, ну и 4G версия....зачем', 'У телефона начал пропадать звук на второй день использования , зависает при звонке - когда берешь трубку, то не ты, ни тебя не слышат. Помогает только перезагрузка. Также очень сильно нагревается, периодически зависает экран- не нажимается при нажатии.']","['Покупала сыну на подарок, работает без нареканий.', 'Рекомендую, хорошо держит заряд и работает шестой!', 'Очень хороший телефон, тем более за эти деньги. дизайн, память, процессор, камеры, экран амолед 120гц всё на высоте!!!', 'хороший бюджетный телефон', 'Для подарка в самый раз!', 'классный, большая память', 'Цена качество нормальное соотношение', 'брал в подарок жене, ей очень понравилось', 'отличный чехол-бампер', 'палет нормальный', 'Смартфон супер', 'Для работы самое то', 'полностью есть всё соответствия с заявленными характеристиками', 'покупал в подарок, однако всё работает, возвращать не стали, ведь буду ещё тчательней осматривать, на голубой телефон чёрный чехол в комплекте, на голубой телефон - нонсенс), а так телефон топ, всё работает, всё синхранизировалось как надо']"
2,product--smartfon-xiaomi-redmi-note-13-pro-5g,"['отличный телефон, по качеству вообще пушка тонкий, зарядка быстрая, камера хорошая+наклеена плёнка на стекло не надо клеить', 'отличный аппарат', 'скорость, камера, экран, память', 'все круто', 'крут за свои деньги!', 'хорош', 'Все отлично, очень шустрый смартфон', 'большой экран, хорошее разрешение, отличный функционал, хорошие камеры.', 'ocean teal очень удачный цвет, в реале выглядит просто класс', 'всё работает, спасибо, отличный телефон', 'Классный', '6 день полет нормальный,', 'хороший продукт', 'отличный', 'телефон хорош, шустрый, всё как заявлено', 'отличный аппарат!', 'круто']","['нет', 'их нет) цена предложение, баланс', 'нет', 'пока не выявил', 'не обнаружил', 'нет', 'быстро садиться аккумулятор', 'пока не обнаружил', 'не выявлены', 'нет', 'пока не нашел']","['после Самсунга ультра привыкать пока струдновато , а так шустрый телефон.', 'единственное что смутило это то что пришел черный в коробке из под белого ну а так смартфон оказался именно тот что заказывал', 'Отличный смартфон.', 'продавец порадовал очень быстро собрал и доставил', 'телефон просто бомба,12 оперативки 512 памяти очень шустрый ,камера лучше чем на редми нот 12, два динамика звук очень классный ,очень доволен телефоном,советую брать', 'Всё супер', 'мне все понравилось!', 'топ', 'Товар соответствует описанию']"
